{
  "schema_version": 5,
  "plan_kind": "greenfield",
  "description": "sample plan — a 3-milestone chain used by the dispatch-completion demo",
  "problem": "demonstrate the dispatch subsystem end to end",
  "approach": "scaffold then implement then verify",
  "executor": "demo",
  "phases": ["build"],
  "terminal": "verify",
  "optimization": {
    "sentinel_fanout": {
      "enabled": false,
      "write_multiplier": 1.25,
      "read_multiplier": 0.1,
      "hit_probability": 0.9
    },
    "b_per_tier": {},
    "context_window_per_tier": {},
    "context_window_override": null,
    "b_override": null
  },
  "providers": {
    "Sonnet": {
      "type": "claudecli",
      "model_id": "claude-sonnet-test",
      "env_secret": null,
      "base_url": null,
      "timeout_ms": 30000,
      "retry_config": { "retries": 0, "min_timeout": 0, "max_timeout": 0, "factor": 1 }
    }
  },
  "effort_max_tokens": { "medium": 4096 },
  "milestones": {
    "scaffold": {
      "description": "create the package skeleton",
      "authored_by": "demo",
      "pending": null,
      "triggered_by": null,
      "phase": "build",
      "depends_on": [],
      "agent": "demo-agent",
      "model": "Sonnet",
      "effort": "medium",
      "two_stage": false,
      "read_only": [],
      "guard": "node -e \"process.exit(0)\""
    },
    "implement": {
      "description": "implement the feature",
      "authored_by": "demo",
      "pending": null,
      "triggered_by": null,
      "phase": "build",
      "depends_on": ["scaffold"],
      "agent": "demo-agent",
      "model": "Sonnet",
      "effort": "medium",
      "two_stage": false,
      "read_only": [],
      "guard": "node -e \"process.exit(0)\""
    },
    "verify": {
      "description": "verify the feature",
      "authored_by": "demo",
      "pending": null,
      "triggered_by": null,
      "phase": "build",
      "depends_on": ["implement"],
      "agent": "demo-agent",
      "model": "Sonnet",
      "effort": "medium",
      "two_stage": false,
      "read_only": [],
      "guard": "node -e \"process.exit(0)\""
    }
  },
  "operations": [
    {
      "id": "scaffold.1", "milestone": "scaffold", "depends_on": [],
      "type": "generative", "action": "create", "file": null, "symbol": null,
      "provenance": "manual", "confidence": "documented", "audit_check": null,
      "criteria": [], "tool": null, "args": null, "guard": null,
      "to_file": null, "to_symbol": null, "ki_estimate": 100, "ki_source": "estimate",
      "authored_by": "demo", "status": "pending",
      "shape": { "kind": "doc", "description": "scaffold the package", "objective": "skeleton exists", "required_sections": [] }
    },
    {
      "id": "implement.1", "milestone": "implement", "depends_on": ["scaffold.1"],
      "type": "generative", "action": "create", "file": null, "symbol": null,
      "provenance": "manual", "confidence": "documented", "audit_check": null,
      "criteria": [], "tool": null, "args": null, "guard": null,
      "to_file": null, "to_symbol": null, "ki_estimate": 100, "ki_source": "estimate",
      "authored_by": "demo", "status": "pending",
      "shape": { "kind": "doc", "description": "implement the feature", "objective": "feature works", "required_sections": [] }
    },
    {
      "id": "verify.1", "milestone": "verify", "depends_on": ["implement.1"],
      "type": "generative", "action": "create", "file": null, "symbol": null,
      "provenance": "manual", "confidence": "documented", "audit_check": null,
      "criteria": [], "tool": null, "args": null, "guard": null,
      "to_file": null, "to_symbol": null, "ki_estimate": 100, "ki_source": "estimate",
      "authored_by": "demo", "status": "pending",
      "shape": { "kind": "doc", "description": "verify the feature", "objective": "tests green", "required_sections": [] }
    }
  ],
  "dispatch_log": []
}
